Iteration,tn,TopicID,Top_Five_Words
4.0,40.0,131.0,florida president vice vote vouchers
4.0,40.0,137.0,would president life campaign simon
4.0,40.0,143.0,one campaign president women letterman
4.0,40.0,144.0,president iran vice campaign women
4.0,40.0,145.0,campaign president would vice one
5.0,40.0,2.0,would economists security social explanation
5.0,40.0,5.0,president lieberman vice pharmacy accountants
5.0,40.0,8.0,president vice madison would jokes
5.0,40.0,11.0,would reserve organization president plan
5.0,40.0,12.0,rough beer beneficiaries campaign prove
5.0,40.0,15.0,resentment hemisphere literature institution germany
5.0,40.0,17.0,president clinton people one like
5.0,40.0,20.0,would shifted president campaign closing
5.0,40.0,21.0,president comparing would humble one
5.0,40.0,22.0,scranton bishop everglades finds clearwater
5.0,40.0,32.0,math valley president education campaign
5.0,40.0,33.0,would security vice president social
5.0,40.0,34.0,resort methodist evans jennifer french
5.0,40.0,37.0,floridas dealer jeb lieberman campaign
5.0,40.0,39.0,president today would campaign radically
5.0,40.0,40.0,letterman show lettermans comedy vice
5.0,40.0,41.0,campaign president would fuzzy new
5.0,40.0,43.0,arafat republican tuesdays east campaign
5.0,40.0,49.0,president muslim techniques campaign vice
5.0,40.0,52.0,chernomyrdin president russia would one
5.0,40.0,53.0,would president secure one assurance
5.0,40.0,61.0,park advised motorcycle gang president
5.0,40.0,62.0,plan tax would cut people
5.0,40.0,64.0,milosevic yugoslavia president yugoslav assaults
5.0,40.0,68.0,characterized mounting president campaign worldclass
5.0,40.0,69.0,president campaign would one vice
5.0,40.0,73.0,downey petroleum restaurant gray cheney
5.0,40.0,75.0,president would pentagons vice gov
5.0,40.0,77.0,hmos big companies engineered industries
5.0,40.0,84.0,campaign republican announcer would hollow
5.0,40.0,90.0,sept death girl executions penalty
5.0,40.0,95.0,sanctions correctly antichoice lifting president
5.0,40.0,96.0,campaign state democrats would lieberman
5.0,40.0,97.0,mass retired weiss campaign sanctions
5.0,40.0,98.0,president vice million texas campaign
5.0,40.0,101.0,percent survey widening poll campaign
5.0,40.0,103.0,would president judge texas vice
5.0,40.0,104.0,marketing reversed organizing festival mockery
5.0,40.0,108.0,campaign governor president mailings texas
5.0,40.0,110.0,president time republican campaign debate
5.0,40.0,113.0,president campaign laboratory supportive viewers
5.0,40.0,120.0,india coastal pakistan new nuclear
5.0,40.0,124.0,president vice campaign would ad
5.0,40.0,126.0,president like anytime clinton would
5.0,40.0,128.0,would tax surplus government social
5.0,40.0,129.0,hybrid due would minimal magnified
5.0,40.0,132.0,god poking makeup divinity rooms
5.0,40.0,135.0,president labor fla lazio one
5.0,40.0,143.0,government brennan standardized stewart would
5.0,40.0,146.0,bushcheney campaign tape conferences charity
5.0,40.0,149.0,president campaign arkansas clinton vice
5.0,40.0,152.0,suspect supplies president complete ignorance
5.0,40.0,153.0,president would campaign duck legitimate
5.0,40.0,156.0,rehnquist would campaign president one
5.0,40.0,157.0,president vice clinton could would
5.0,40.0,158.0,president campaign vice clinton east
5.0,40.0,160.0,lieberman president vice one lazio
5.0,40.0,169.0,campaign presidential orlando trading gov
5.0,40.0,171.0,edge slight sheet grasp articulate
5.0,40.0,172.0,president journalists campaign prone vice
5.0,40.0,174.0,goremccain microsoft spokesmen commented consumers
5.0,40.0,179.0,giant campaign bears would texas
5.0,40.0,181.0,cheney roberts campaign gilmore political
5.0,40.0,188.0,president campaign would new vice
5.0,40.0,190.0,materials welcomed husseins polish monitor
5.0,40.0,195.0,lieberman vice president new carrying
5.0,40.0,196.0,would plan motherinlaw vouchers campaign
5.0,40.0,211.0,heating campaign president peacekeeping oil
5.0,40.0,212.0,teachers president restrictions campaign house
5.0,40.0,214.0,cheek governor approved state years
5.0,40.0,216.0,abortion one campaign republican president
5.0,40.0,218.0,concludes surrender commonly president canada
5.0,40.0,219.0,singers president dragging children recorded
5.0,40.0,222.0,campaign president money republican reform
1.0,100.0,4.0,diplomatic arab clinton new crisis
1.0,100.0,6.0,alliance rid avoids percent windfall
1.0,100.0,9.0,campaign president outofpocket drug would
1.0,100.0,12.0,campaign percent one president party
1.0,100.0,21.0,anchor campuses texas would microsoft
1.0,100.0,27.0,rangers teams stadium campaign texas
1.0,100.0,30.0,president campaign vice would gov
1.0,100.0,43.0,arlington president campaign vice one
1.0,100.0,46.0,president campaign would vice governor
1.0,100.0,51.0,president million vice v would
1.0,100.0,52.0,mauro environmental president texas would
1.0,100.0,55.0,clinton president campaign oprah debates
1.0,100.0,64.0,campaign president vice materials one
1.0,100.0,69.0,madison avenue park campaign joyce
1.0,100.0,71.0,would president republican campaign vice
1.0,100.0,73.0,campaign president would vice plan
1.0,100.0,77.0,clinton president simpson campaign vice
1.0,100.0,80.0,firms saddam iraq president clintongore
1.0,100.0,85.0,women men campaign underdog rough
1.0,100.0,92.0,subliminal girl campaign women president
1.0,100.0,95.0,marketing campaign ignore republican st
1.0,100.0,99.0,gun president control would pennsylvania
1.0,100.0,101.0,percent poll voters nader buchanan
1.0,100.0,105.0,would fla yugoslavia president tampa
1.0,100.0,109.0,letterman like campaign voters people
1.0,100.0,125.0,president clinton campaign one vice
1.0,100.0,126.0,mrs campaign president clinton vice
1.0,100.0,127.0,president clinton campaign would vice
1.0,100.0,131.0,marshall channels viewers televised reached
1.0,100.0,137.0,president campaign cecil tossup vice
1.0,100.0,139.0,campaign president would clinton one
1.0,100.0,141.0,minister goremccain prime adam corp
1.0,100.0,142.0,president texas would campaign presidential
1.0,100.0,145.0,campaign cheney texas president voting
2.0,100.0,0.0,would education teachers vouchers chester
2.0,100.0,3.0,campaign president debate vice gun
2.0,100.0,9.0,lazio president clinton rick mrs
2.0,100.0,12.0,arafat east predate middle president
2.0,100.0,14.0,beach rehnquist rock newport collective
2.0,100.0,27.0,study texas rand scores test
2.0,100.0,29.0,would foreign campaign states president
2.0,100.0,31.0,campaign president feingold sale one
2.0,100.0,32.0,vice president campaign women would
2.0,100.0,34.0,breaking jordan automatic president texas
2.0,100.0,35.0,president stemmed would policy reestablish
2.0,100.0,36.0,would president lawyers vice abortion
2.0,100.0,39.0,gun clearer rejection republican approximately
2.0,100.0,42.0,would president environmentalist campaign league
2.0,100.0,45.0,campaign president debate vice governor
2.0,100.0,49.0,would president abortion vice could
2.0,100.0,51.0,environmental name gorechernomyrdin front page
2.0,100.0,56.0,president texas debate would hunger
2.0,100.0,61.0,emergency pipeline would materials president
2.0,100.0,65.0,clinton new lazio president would
2.0,100.0,68.0,percent campaign president public encounters
2.0,100.0,69.0,would visits plan campaign tax
2.0,100.0,70.0,president crime would republican governor
2.0,100.0,74.0,president campaign abortion one flint
2.0,100.0,77.0,leno jay lenos threeday convention
2.0,100.0,80.0,sanctions castro goldstein president per
2.0,100.0,81.0,campaign president forums tape would
2.0,100.0,83.0,president supportive campaign landslide ticking
2.0,100.0,88.0,would spender marketing debt tax
2.0,100.0,93.0,seniors would drug longshot pill
2.0,100.0,95.0,nader voting state president gov
2.0,100.0,96.0,hypothetical corridor case would president
2.0,100.0,97.0,vidal conversational strict would bomb
2.0,100.0,104.0,would westchester upstate heights foreign
2.0,100.0,108.0,visited posts president explosive advised
2.0,100.0,111.0,campaign christian president would resentment
2.0,100.0,120.0,barrels president quarter hussein saddam
2.0,100.0,124.0,union trade president would loan
2.0,100.0,125.0,campaign would president clinton vice
2.0,100.0,129.0,would maintains one president years
2.0,100.0,132.0,winter oil president new prices
2.0,100.0,137.0,shortterm preparing art cheney would
2.0,100.0,144.0,cheney regulatory gingrich campaign newt
2.0,100.0,145.0,president bosnia unmarried troops campaign
2.0,100.0,153.0,campaign ad president would firing
2.0,100.0,156.0,madison avenue progressive tax campaign
2.0,100.0,160.0,families emissions would plan tax
2.0,100.0,162.0,wealthiest president vice would putin
2.0,100.0,163.0,refuses president campaign would evils
2.0,100.0,165.0,brookings institution deputy identical override
2.0,100.0,167.0,would motivated inches campaign president
2.0,100.0,169.0,president ron would embellishing campaign
2.0,100.0,171.0,voters would men like president
2.0,100.0,172.0,would president temptation campaign clinton
2.0,100.0,176.0,president variations negotiations men theater
2.0,100.0,182.0,feb regret yankees cheney games
2.0,100.0,190.0,president would campaign vice oil
2.0,100.0,193.0,plants tapping president challenger sweet
2.0,100.0,194.0,agreement president campaign vice mud
2.0,100.0,195.0,president campaign clinton issues like
2.0,100.0,200.0,campaign new percent republican texas
2.0,100.0,203.0,bureaucrats declares taped would undecided
2.0,100.0,204.0,president republican firms campaign jason
2.0,100.0,205.0,specify ravitch plan campaign resembles
2.0,100.0,209.0,letter misstated office gov requested
2.0,100.0,210.0,oil bacon prices dog president
3.0,100.0,1.0,exaggerated would shell president historical
3.0,100.0,7.0,president vice panels complaint regulating
3.0,100.0,11.0,lieberman prevalence mores campaign milwaukee
3.0,100.0,12.0,president nader naacp polite would
3.0,100.0,19.0,oprah winfrey state texas president
3.0,100.0,25.0,campaign president would clinton vice
3.0,100.0,28.0,immigrants useful evaluate impose deny
3.0,100.0,29.0,predictions column youthful casey president
3.0,100.0,31.0,east president hussein administration saddam
3.0,100.0,36.0,inc industry corzine rifle association
3.0,100.0,37.0,downey stayathome heads wisdom hall
3.0,100.0,40.0,president true quoting would one
3.0,100.0,41.0,bipartisanship democrats texas ordered statewide
3.0,100.0,42.0,president reiner vice one democratic
3.0,100.0,43.0,barn envelope schuster printed uncover
3.0,100.0,44.0,president republican campaign clinton think
3.0,100.0,48.0,log exulted chapter announces republican
3.0,100.0,49.0,would campaign president federal vice
3.0,100.0,50.0,whoever alaska larry timess story
3.0,100.0,54.0,campaign vice president ore percent
3.0,100.0,61.0,simon photograph cabinet simons member
3.0,100.0,63.0,visited lieberman jones president vice
3.0,100.0,70.0,percent nader voters voucher vote
3.0,100.0,77.0,stewart michigans president educated jon
3.0,100.0,86.0,court souter roe would schools
3.0,100.0,88.0,ninth everyday village garden avenue
3.0,100.0,92.0,language moines des debate three
3.0,100.0,95.0,guarantee would threatens security social
3.0,100.0,96.0,health ok drop president miller
3.0,100.0,100.0,president madonna vice teenage spots
3.0,100.0,101.0,russian would president weapons arms
3.0,100.0,103.0,president voters vice would percent
3.0,100.0,108.0,would campaign wealthiest president schools
3.0,100.0,110.0,oil prices would people percent
3.0,100.0,116.0,president cheney would today lieberman
3.0,100.0,117.0,president neck one like gay
3.0,100.0,120.0,hollywood would sneak entertainment president
3.0,100.0,121.0,president vice wealthiest hoping warfare
3.0,100.0,122.0,reagan compassionate conservatism conservative president
3.0,100.0,123.0,lawyers trial ticking developments president
3.0,100.0,127.0,offices wins president call would
3.0,100.0,130.0,louis president st vice debate
3.0,100.0,133.0,messages tax explaining plan bracket
3.0,100.0,134.0,worlds letterman thoroughly debate death
3.0,100.0,135.0,reserve revival vidals business claimed
3.0,100.0,140.0,fashion follows nevertheless serves civil
3.0,100.0,142.0,lieberman campaign hypocritical column president
3.0,100.0,148.0,percent nader poll buchanan nov
3.0,100.0,149.0,campaign president would settings fundraising
3.0,100.0,159.0,chernomyrdin campaign policy september gorechernomyrdin
3.0,100.0,160.0,silly glee grumbled worthy camps
3.0,100.0,161.0,subsidy pattern supply timber wilderness
3.0,100.0,174.0,utilities deregulation enron employment lobbied
3.0,100.0,177.0,withholding bonus wrong massacre explained
3.0,100.0,182.0,anecdote one ron andrew shoes
3.0,100.0,184.0,speeding coastal new weekly lag
3.0,100.0,189.0,anonymous conservative would president campaign
3.0,100.0,190.0,lieberman incidence pharmacy improved sales
3.0,100.0,193.0,letterman president accepted debate lettermans
3.0,100.0,194.0,effectiveness enjoy wellstone dampen tag
3.0,100.0,198.0,reviewing refuse would violated president
3.0,100.0,201.0,christian coalition alienating staunchly lifts
3.0,100.0,210.0,hume cried finish president brit
3.0,100.0,225.0,would allocate devine campaign one
3.0,100.0,235.0,refuge strategic arctic president environmental
3.0,100.0,236.0,advised bauer artist cities president
3.0,100.0,237.0,heating would president visited federal
3.0,100.0,240.0,concentrated fair would buchanans campaign
3.0,100.0,243.0,per fulltime consulting georgetown cliff
3.0,100.0,245.0,million crises money women national
3.0,100.0,246.0,sanctions president arkansas abortion campaign
3.0,100.0,251.0,oil louisiana texas proponent conditions
3.0,100.0,253.0,york campaign new president evenly
3.0,100.0,255.0,rubin union president would unions
3.0,100.0,262.0,texas health care children campaign
3.0,100.0,270.0,pulls law edwards superior would
3.0,100.0,273.0,president vice clinton campaign lieberman
3.0,100.0,275.0,minister texas state policy campaign
3.0,100.0,277.0,gun control rifle hinted association
3.0,100.0,279.0,president fresno column dowd rican
3.0,100.0,280.0,evils president pursuit gen husseins
3.0,100.0,281.0,president yugoslavia would court campaign
3.0,100.0,282.0,spiritual violent disdain religious westchester
3.0,100.0,288.0,president minor education campaign governor
3.0,100.0,296.0,hunger approved nobel president industry
3.0,100.0,298.0,anytime arms washingtons moscow ii
3.0,100.0,308.0,vouchers firms k albright president
3.0,100.0,310.0,approve republican simmons campaign derided
3.0,100.0,311.0,mandatory wooden suffer wardrobe one
3.0,100.0,314.0,ambassador diplomat switch familiarity president
3.0,100.0,317.0,circumvent prompt president hole would
3.0,100.0,322.0,marketing legitimate christian practices pander
3.0,100.0,326.0,vidal would bomb unemployment conditions
3.0,100.0,328.0,cheney president elementary campaign gone
3.0,100.0,333.0,generals ruling abide bust campaign
3.0,100.0,337.0,obtained letters contends improperly involving
3.0,100.0,342.0,one campaign gun president district
3.0,100.0,343.0,death tucker clinton motivated penalty
4.0,100.0,6.0,campaign quintessential president translated ignores
4.0,100.0,8.0,oil language sweeping demand president
4.0,100.0,11.0,president oil clinton vice campaign
4.0,100.0,16.0,president europe v vice worlds
4.0,100.0,28.0,findings metropolitan blaming skyrocketing combative
4.0,100.0,30.0,dismissal firms fascinating traction description
4.0,100.0,32.0,garden alliance albright madeleine messy
4.0,100.0,33.0,standardized would care tag education
4.0,100.0,35.0,readiness levels figures military troops
4.0,100.0,36.0,president would education vice candidates
4.0,100.0,39.0,campaign selfinterest commercial civic touted
4.0,100.0,42.0,corporation release income bushcheney campaign
4.0,100.0,45.0,refuge arctic development oil alaska
4.0,100.0,49.0,campaign would president check time
4.0,100.0,50.0,expenses cared families parallels parents
4.0,100.0,52.0,faithful dennis respected hastert deputies
4.0,100.0,53.0,sanctions president albright governor k
4.0,100.0,63.0,hate bill vote crimes orientation
4.0,100.0,69.0,stumbles lieberman president campaign vice
4.0,100.0,83.0,ark president campaign vice shield
4.0,100.0,87.0,glenn bishop dylan opponent president
4.0,100.0,94.0,would debate texas vice president
4.0,100.0,97.0,opposes president campaign replaced mentions
4.0,100.0,104.0,quarter adds valley silicon hightech
4.0,100.0,106.0,sanchez committees families would child
4.0,100.0,108.0,eugene surged patients winter catastrophic
4.0,100.0,113.0,hypocrisy morality reality settings republican
4.0,100.0,114.0,persistent instant knoxville campaign president
4.0,100.0,125.0,chernomyrdin russia gorechernomyrdin viktor united
4.0,100.0,139.0,watched viewers televised reached households
4.0,100.0,152.0,towns president preparation would security
4.0,100.0,155.0,crisis diplomatic president deciding owners
4.0,100.0,161.0,fuzzy internet screen desperation president
4.0,100.0,164.0,drug jokes rifle president association
4.0,100.0,167.0,children uninsured coverage health families
4.0,100.0,171.0,reserve jimmy issued defeat president
4.0,100.0,175.0,goremccain bernard nj impose matthew
4.0,100.0,179.0,marketed cheney president would prickly
4.0,100.0,183.0,release bay valley president vice
4.0,100.0,187.0,president clinton campaign actions cramer
4.0,100.0,194.0,would vice president today campaign
4.0,100.0,196.0,kerrey movements king shouldnt social
4.0,100.0,200.0,leno president claimed dinner performances
4.0,100.0,202.0,ministers evangelical threatening finally memories
4.0,100.0,204.0,oil staying president campaign planning
4.0,100.0,207.0,president smashing roaring vice years
4.0,100.0,211.0,recast bloomfield president campaign clinton
4.0,100.0,214.0,east electorate rough women men
4.0,100.0,215.0,votes permit total tim draws
4.0,100.0,217.0,math education federal president would
4.0,100.0,219.0,relief pays stick tax doubling
4.0,100.0,224.0,rangers bobby valentine mattingly collective
4.0,100.0,230.0,writer nonprofit walker rooted cats
4.0,100.0,231.0,neck ballot electoral votes states
4.0,100.0,233.0,rejecting altogether campaign responded president
4.0,100.0,234.0,yorker deeply cites claims tortured
4.0,100.0,239.0,assailed president demeanor would campaign
4.0,100.0,240.0,mauro yes asked meanwhile decline
4.0,100.0,245.0,el paso texas governor city
4.0,100.0,247.0,cohen money demanded volume anonymity
4.0,100.0,249.0,president clinton fired campaign voters
4.0,100.0,250.0,president senate would vice lieberman
4.0,100.0,258.0,vice president tactics statements contested
4.0,100.0,259.0,percent poll voters nader polls
4.0,100.0,266.0,dc president formulation improper whos
4.0,100.0,269.0,citizens therefore teachers would plan
4.0,100.0,271.0,president tax northwest would administrations
4.0,100.0,275.0,campaign president would clinton vice
4.0,100.0,278.0,notable preserve absurd thriving would
4.0,100.0,280.0,web sites campaign last houston
4.0,100.0,281.0,hmo president dogs sold says
4.0,100.0,282.0,august ny retired conscious c
4.0,100.0,293.0,disagree disagreed women regulating tongue
4.0,100.0,294.0,ill case appeals graham execution
4.0,100.0,297.0,russell republican wisconsin conservatives satellite
4.0,100.0,306.0,timess serial would president campaign
4.0,100.0,307.0,supply wilderness isnt would agreed
4.0,100.0,311.0,black arlington president voters people
4.0,100.0,317.0,sailors question would rally also
4.0,100.0,318.0,restaurant roads nearby fancy shower
4.0,100.0,319.0,crop president percent years favorite
4.0,100.0,321.0,pop bright store orange documentary
4.0,100.0,322.0,tuesdays counseling reagan negotiations honest
4.0,100.0,323.0,disappear disingenuous amazing explanation forever
4.0,100.0,326.0,readers susceptible cookies campbell percent
4.0,100.0,327.0,devine president would campaign vice
4.0,100.0,330.0,hip nra texas holster would
4.0,100.0,331.0,district forests environmental congress republican
4.0,100.0,338.0,neckandneck simon distinction sorts would
4.0,100.0,341.0,ads excuse campaign president would
4.0,100.0,342.0,government bureaucracy administration governor president
4.0,100.0,348.0,mccain willingness number strained mccains
4.0,100.0,350.0,campaign vindicated gun president mrs
4.0,100.0,351.0,neck tax families bluecollar would
4.0,100.0,354.0,cheney credibility pattern commercial voting
4.0,100.0,355.0,board cases clemency guidelines boards
4.0,100.0,357.0,kennedy friedrich democrats proud notably
4.0,100.0,360.0,women percent rallies evenly divided
4.0,100.0,370.0,unborn archbishop bob jones oconnor
4.0,100.0,379.0,athletic anybody interesting mix dead
4.0,100.0,380.0,associations would campaign women president
4.0,100.0,384.0,leno would one like jay
4.0,100.0,386.0,page lazio front frankly governing
4.0,100.0,393.0,thoroughly disparity reignited nagging president
4.0,100.0,394.0,approaches economists dire everybodys unrelated
4.0,100.0,395.0,materials conferences emergency debate pipeline
4.0,100.0,401.0,winter bipartisanship ark superintendent rock
4.0,100.0,402.0,reverse charges disruption allegations newly
4.0,100.0,403.0,lesser president vice lawyers clinton
4.0,100.0,409.0,new york iowa advertisement radio
4.0,100.0,410.0,unions union members labor president
4.0,100.0,417.0,slap disappear cheney logic marked
4.0,100.0,418.0,sterling president would economy stinging
4.0,100.0,420.0,peacekeeping visited ad vice bosnia
4.0,100.0,436.0,region anybody transcript cotton happening
4.0,100.0,439.0,plant subsidized farm details spelled
4.0,100.0,441.0,computer president internet council steps
4.0,100.0,443.0,state president governor would south
4.0,100.0,448.0,tax economic state plan would
4.0,100.0,450.0,purple france names campaign eyes
4.0,100.0,457.0,iran aid visited european treaty
4.0,100.0,465.0,voiced passage president statement must
4.0,100.0,467.0,gouging economist polish price hire
4.0,100.0,470.0,would president campaign state democratic
4.0,100.0,474.0,andrew nixon qualifications clothes suit
4.0,100.0,476.0,waved president morris cheney movies
4.0,100.0,490.0,bushgore credible scheduling debate attract
4.0,100.0,491.0,campaign school minutes send president
4.0,100.0,500.0,resentment hunters neighbors liking reserves
4.0,100.0,504.0,word would capitalize comedy trap
4.0,100.0,508.0,regret president flag vice practical
4.0,100.0,509.0,brooklyn dr adam corp physical
4.0,100.0,518.0,tax surplus president would billion
4.0,100.0,522.0,article woman undecided mailings frontpage
4.0,100.0,536.0,stanley cole adequate president campaign
